{
  "schemaVersion": 1,
  "id": "plenitude",
  "title": "Plenitude",
  "order": 1,
  "sections": [
    { "id": "great-divide", "title": "The Great Divide", "order": 1, "package": "sections/great-divide/section.json" },
    { "id": "philadelphia-symphony-story", "title": "The Philadelphia (Orchestra) Story", "order": 2, "package": "sections/philadelphia-symphony-story/section.json" },
    { "id": "class-in-america", "title": "Class in America", "order": 3, "package": "sections/class-in-america/section.json" },
    { "id": "case-of-music", "title": "The Case of Music", "order": 4, "package": "sections/case-of-music/section.json" },
    { "id": "shocking-art", "title": "Shocking Art", "order": 5, "package": "sections/shocking-art/section.json" },
    { "id": "art-as-special-interest", "title": "Art as a Special Interest", "order": 6, "package": "sections/art-as-special-interest/section.json" },
    { "id": "communities-and-creativity", "title": "Communities and Creativity", "order": 7, "package": "sections/communities-and-creativity/section.json" }
  ]
}
